tc0344,"DU FRESNY, Charles Rivière","LE FAUX INSTINCT, COMÉDIE",1707,1707,Comédie,moeurs françaises,Cinq actes,prose,DUFRESNY_FAUXINSTINCT
tc0345,"DUFRESNY, Charles","LE FAUX SINCÈRE, COMÉDIE.",n.av.,1731,Comédie,moeurs françaises,Cinq actes,vers,DUFRESNY_FAUXSINCERE
tc0346,"DUFRESNY, Charles Rivière","LE JALOUX HONTEUX, COMÉDIE",1699,1708,Comédie,moeurs françaises,Cinq actes,prose,DUFRESNY_JALOUXHONTEUX
tc0347,"DUFRESNY, Charles Rivière","LA JOUEUSE, COMÉDIE",1699,1699,Comédie,moeurs françaises,Cinq actes,prose,DUFRESNY_JOUEUSE
tc0348,"DU FRESNY, Charles Rivière","LA MALADE SANS MALADIE, COMÉDIE",1699,1699,Comédie,moeurs françaises,Cinq actes,prose,DUFRESNY_MALADESANSMALADIE
tc0349,"DUFRESNY, Charles","LES MAL-ASSORTIS, COMÉDIE EN DEUX ACTES.",n.av.,1693,Comédie,moeurs françaises,Deux actes,mixte,DUFRESNY_MALASSORTIS
tc0350,"DUFRESNY, Charles","LE MARIAGE FAIT ET ROMPU, COMÉDIE",n.av.,1721,Comédie,moeurs françaises,Trois actes,vers,DUFRESNY_MARIAGEFAITETROMPU
tc0351,"DUFRESNY, Charles","LE NÉGLIGENT, COMÉDIE EN TROIS ACTES, AVEC UN PROLOGUE.",n.av.,1692,Comédie,moeurs françaises,"Trois actes, un prologue",prose,DUFRESNY_NEGLIGENT
tc0352,"DUFRESNY, Charles","LA NOCE INTERROMPUE, COMÉDIE UN ACTE.",n.av.,1699,Comédie,moeurs françaises,Un acte,prose,DUFRESNY_NOCEINTERROMPUE
tc0353,"DUFRESNY, Charles","LA RÉCONCILIATION NORMANDE, COMÉDIE.",n.av.,1719,Comédie,moeurs françaises,Cinq actes,vers,DUFRESNY_RECONCILIATIONNORMANDE
tc0354,REGNARD et DUFRESNY,"L'AUGMENTATION DE LA BAGUETTE, COMÉDIE EN UN ACTE",1693,1693,Comédie,moeurs françaises,Quatre actes,mixte,DUFRESNYREGNARD_AUGMENTATIONBAGUETTE
tc0355,REGNARD et DUFRESNY,"LA BAGUETTE DE VULCAIN, COMÉDIE EN UN ACTE",1692,1693,Comédie,moeurs françaises,Quatre actes,mixte,DUFRESNYREGNARD_BAGUETTEVULCAIN
tc0356,"REGNARD, Jean-François","LES CHINOIS, COMÉDIE EN QUATRE ACTES",1692,1692,Comédie,moeurs françaises,Quatre actes,mixte,DUFRESNYREGNARD_CHINOIS
tc0357,REGNARD et DUFRESNY,"LA NAISSANCE D'AMADIS, COMÉDIE EN UN ACTE",1692,1694,Comédie,moeurs françaises,Un acte,mixte,DUFRESNYREGNARD_NAISSANCEDAMADIS
tc0358,"REGNARD, Jean-François","LA SUITE DE LA FOIRE SAINT-GERMAIN, OU LES MOMIES D'ÉGYPTE, COMÉDIE",n.av.,1696,Comédie,moeurs françaises,Un acte,mixte,DUFRESNYREGNARD_SUITEFOIRESAINTGERMAIN
tc0359,"DUGAZON,  Henri Jean-Henri Gourgaud dit","LE MODÉRÉ, COMÉDIE EN UN ACTE ET EN VERS",n.av.,1793,Comédie,moeurs françaises,Un acte,vers,DUGAZON_MODERE
tc0360,"DUMANIANT, Antoine-Jean Bourlin dit","LE DRAGON DE THIONVILE, FAIT HISTORIQUE EN UN ACTE, ET EN PROSE",n.av.,1786,Fait historique,moeurs françaises,Un acte,prose,DUMANIANT_DRAGONDETHIONVILLE
tc0361,"CORNEILLE, Pierre","MONSIEUR DE BIEVRE, OU L'ABUS DE L'ESPRIT, CALEMBOURG, EN UN ACTE ET EN VAUDEVILLE",n.av.,1798,Comédie,moeurs françaises,Un acte,mixte,DUPATY-LUCE-SALVERTE_BIEVRE
tc0362,"DUPATY, Emmanuel","ARLEQUIN TOUT SEUL, COMÉDIE-MONOLOGUE",n.av.,1798,Comédie,moeurs françaises,Un acte,mixte,DUPATY_ARLEQUINTOUTSEUL
tc0363,"FERIOL DE PONT-DE-VEYLE, Antoine de","LE SOMNAMBULE, COMÉDIE.",n.av.,1739,Comédie,moeurs françaises,Un acte,prose,DUPONTDEVEYLE_SOMNANBULE
tc0364,"DURANT, Catherine","À BON CHAT BON RAT, PROVERBE.",n.av.,1699,Proverbe,moeurs françaises,Un acte,prose,DURANT_ABONCHATBONRAT
tc0365,"DURANT, Catherine","À LAVER LA TÊTE D'ÂNE ON Y PERD SA LESSIVE, PROVERBE.",n.av.,1699,Proverbe,moeurs françaises,Un acte,prose,DURANT_ALAVERLATETE
tc0366,"DURANT, Catherine","BONNE RENOMÉE VAUT MIEUX QUE CEINTUR DORÉE, PROVERBE.",n.av.,1699,Proverbe,moeurs françaises,Un acte,prose,DURANT_BONNERENOMMEE
tc0367,"DURANT, Catherine","LES JOURS SE SUIVENT ET NE SE RESSEMBLENT PAS, PROVERBE.",n.av.,1699,Proverbe,moeurs françaises,Trois actes,prose,DURANT_JOURSSESUIVENT
tc0368,"DURANT, Catherine","OISIVITÉ EST MÈRE DE TOUS LES VICES, PROVERBE.",n.av.,1699,Proverbe,moeurs françaises,Un acte,prose,DURANT_OISIVETE
tc0369,"DURANT, Catherine","ON NE CONNAIT PAS LE VIN AU CERCLE, PROVERBE.",n.av.,1699,Proverbe,moeurs françaises,Un acte,prose,DURANT_ONNECONNAITPASLEVIN
tc0370,"DURANT, Catherine","POUR UN PLAISIR MILLE DOULEURS, PROVERBE.",n.av.,1699,Proverbe,moeurs françaises,Un acte,prose,DURANT_POURUNPLAISIRMILLEDOULEURS
tc0371,"DURANT, Catherine","QUI COURT DEUX LIÈVRES N'EN PREND POINT, PROVERBE.",n.av.,1699,Proverbe,moeurs françaises,Un acte,prose,DURANT_QUICOURTDEUXLIEVRES
tc0372,"DURANT, Catherine","TEL MAÎTRE, TEL VALET, PROVERBE.",n.av.,1699,Proverbe,moeurs françaises,Un acte,prose,DURANT_TELMAITRETELVALET
tc0373,"DURANT, Catherine","VOYAGE DE CAMPAGNE, PROVERBE",n.av.,1699,Proverbe,moeurs françaises,Un acte,prose,DURANT_VOYAGEDECAMPAGNE
tc0374,"DU RYER, Pierre","ALCIMÉDON, TRAGI-COMÉDIE",1636,1636,Tragi-comédie,mythe grec,Cinq actes,vers,DURYER_ALCIMEDON
tc0375,"DU RYER, Pierre","ALCIONÉE ou LE COMBAT de L'HONNEUR et de L'AMOUR, TRAGÉDIE",1640,1640,Tragédie,mythe grec,Cinq actes,vers,DURYER_ALCIONEE
tc0376,"DU RYER, Pierre",ANAXANDRE. TRAGI-COMÉDIE.,1655,1655,Tragi-comédie,mythe grec,Cinq actes,vers,DURYER_ANAXANDRE
tc0377,"DU RYER, Pierre","ARGENIS ET POLIARQUE ou THÉOCRINE, TRAGI-COMÉDIE",1630,1630,Tragi-comédie,mythe grec,Cinq actes,vers,DURYER_ARGENISPOLIARQUE
tc0378,"DU RYER, Pierre","BÉRÉNICE, TRAGI-COMÉDIE EN PROSE.",1642,1635,Tragi-comédie,moeurs antiques,Cinq actes,prose,DURYER_BERENICE
tc0379,"DU RYER, Pierre","CLÉOMÉDON, TRAGI-COMÉDIE.",1644,1636,Tragi-comédie,Astrée,Cinq actes,vers,DURYER_CLEOMEDON
tc0380,"DU RYER, Pierre","DYNAMIS, REINE DE CARIE. TRAGI-COMÉDIE",1653,1653,Tragi-comédie,moeurs françaises,Cinq actes,vers,DURYER_DYNAMIS
tc0381,"DU RYER, Pierre","ESTHER, TRAGÉDIE.",1644,1644,Tragédie,bible,Cinq actes,vers,DURYER_ESTHER
tc0382,"DU RYER, Pierre","LISANDRE et CALISTE, TRAGI-COMÉDIE",1632,1632,Tragi-comédie,moeurs françaises,Cinq actes,vers,DURYER_LISANDRECALISTE
tc0383,"DU RYER, Pierre",LUCRÈCE. TRAGÉDIE,1638,1638,Tragédie,histoire romaine,Cinq actes,vers,DURYER_LUCRECE
tc0384,"DU RYER, Pierre","NITOCRIS, REINE DE BABYLONE. TRAGI-COMÉDIE",1650,1650,Tragi-comédie,histoire romaine,Cinq actes,vers,DURYER_NITOCRIS
tc0385,"DU RYER, Pierre","SAÜL, TRAGÉDIE.",1642,1642,Tragédie,bible,Cinq actes,vers,DURYER_SAUL
tc0386,"DU RYER, Pierre","SCÉVOLE, TRAGÉDIE.",1647,1647,Tragédie,histoire romaine,Cinq actes,vers,DURYER_SCEVOLE
tc0387,"DU RYER, Pierre","THÉMISTOCLE, TRAGÉDIE.",1647,1648,Tragédie,histoire grecque,Cinq actes,vers,DURYER_THEMISTOCLE
tc0388,"DU RYER, Pierre","LES VENDANGES DE SURESNES, COMÉDIE",1636,1636,Comédie,moeurs françaises,Cinq actes,vers,DURYER_VENDANGESDESURESNES
tc0389,"FABRE D'EGLANTINE, Jean-François-Nazaire Fabre dit","LE PHILINTE DE MOLIÈRE, COMÉDIE EN CINQ ACTES, EN VERS.",n.av.,1790,Comédie,moeurs françaises,Quatre actes,vers,FABREDEGLANTINE_PHILINTEDEMOLIERE
tc0390,"FAVART, Charles-Simon","L'ANGLAIS À BORDEAUX, COMÉDIE.",n.av.,1743,Comédie,moeurs françaises,Un acte,vers,FAVART_ANGLAISDEBORDEAUX
tc0391,"FLORIAN, Jean Pierre Claris de","LE BON MÉNAGE, COMÉDIE",n.av.,1788,Comédie,moeurs françaises,Un acte,prose,FLORIAN_BONMENAGE
tc0392,"FLORIAN, Jean Pierre Claris de","LE BON PÈRE, COMÉDIE",n.av.,1788,Comédie,moeurs françaises,Un acte,prose,FLORIAN_BONPERE
tc0393,"FLORIAN, Jean Pierre Claris de","LES DEUX BILLETS, COMÉDIE",n.av.,1779,Comédie,moeurs françaises,Un acte,prose,FLORIAN_DEUXBILLETS
tc0394,"FLORIAN, Jean Pierre Claris de","HÉRO ET LÉANDRE, MONOLOGUE LYRIQUE",n.av.,1788,Monologue lyrique,mythe grec,Un acte,prose,FLORIAN_HEROLEANDRE
tc0395,"FLORIAN, Jean Pierre Claris de","LES JUMEAUX DE BERGAME, COMÉDIE",n.av.,1782,Comédie,moeurs françaises,Un acte,prose,FLORIAN_JUMEAUXDEBERGAME
tc0396,"FOLARD, Melchior de","THÉMISTOCLE, TRAGÉDIE ",n.av.,1729,Tragédie,histoire grecque,Cinq actes,vers,FOLARD_THEMISTOCLE
tc0397,"FONTENELLE, Bernard le Bouvier ou le Bouyer de","ENDYMION, PASTORALE HÉROÏQUE",n.av.,1731,Pastorale héroïque,mythe grec,Cinq actes,vers,FONTENELLE_ENDYMION
tc0398,"FUZELIER, Louis","L'ENFER GALANT, PARODIE",n.av.,1729,Parodie,mythe grec,Un acte,mixte,FUZELIER_ENFERGALANT
tc0399,"FUZELIER, Louis","ORPHÉE, OU ARLEQUIN AUX ENFERS, DIVERTISSEMENT.",n.av.,1711,Divertissement,moeurs françaises,Un acte,vers,FUZELIER_ORPHEE
tc0400,"FUZELIER, Louis","SCARAMOUCHE PÉDANT, DIVERTISSEMENT.",n.av.,1711,Divertissement,moeurs françaises,Un acte,vers,FUZELIER_SCARAMOUCHEPEDANT
tc0401,"FUZELIER, Louis et LEGRAND, Marc-Antoine","LES ANIMAUX RAISONNABLES, OPÉRA COMIQUE",n.av.,1718,Opéra comique,moeurs françaises,Un acte,mixte,FUZELIERLEGRAND_ANIMAUXRAISONNABLES
tc0402,"FUZELIER, Louis et 	LESAGE, Alain-René","LE TABLEAU DU MARIAGE, COMÉDIE",n.av.,1712,Opéra comique,moeurs françaises,Un acte,mixte,FUZELIERLESAGE_TABLEAUDUMARIAGE
tc0403,"GENEST, Claude-Charles","PÉNÉLOPE, TRAGÉDIE EN CINQ ACTES.",n.av.,1684,Tragédie,mythe grec,Cinq actes,vers,GENEST_PENELOPE
tc0404,"GILBERT, Gabriel","RODOGUNE, TRAGI-COMÉDIE.",1732,1646,Tragi-comédie,histoire antique,Cinq actes,vers,GILBERT_RODOGUNE
tc0405,"GILBERT, Gabriel","TÉLÉPHONTE, TRAGI-COMÉDIE.",1732,1662,Tragi-comédie,histoire antique,Cinq actes,vers,GILBERT_TELEPHONTE
tc0406,GILLET DE LA TESSONERIE,"LE CAMPAGNARD, COMÉDIE EN CINQ ACTES",n.av.,1657,Comédie,moeurs françaises,Cinq actes,vers,GILLET_CAMPAGNARD
tc0407,GILLET DE LA TESSONERIE,"LE DÉNIAISÉ, COMÉDIE",n.av.,1647,Comédie,moeurs françaises,Cinq actes,vers,GILLET_DENIAISE
tc0408,"REGNARD, Jean-François","LE MARCHAND RIDICULE, COMÉDIE",n.av.,1695,Comédie,moeurs françaises,Un acte,prose,GILLOTREGNARD_MARCHANDRIDICULE
tc0409,"GOUGES, Olympe de Gouges","L'ESCLAVAGE DES NOIRS, OU L'HEUREUX NAUFRAGE, DRAME",1792,1792,Drame,moeurs françaises,Trois actes,prose,GOUGES_EXCLAVAGEDESNOIRS
tc0410,"GOUGES, Olympe de Gouges","MOLIÈRE CHEZ NINON OU LE SIÈCLE DES GRANDS HOMMES, PIÈCE EPISODIQUE ",1792,1788,Pièce épisodique,moeurs françaises,Cinq actes,prose,GOUGES_MOLIERENINON
tc0411,"GOULARD, Jean-François-Thomas","AGIS, PARODIE d'AGIS.",n.av.,1782,Parodie,histoire grecque,Un actes,vers,GOULARD_AGIS
tc0412,"GOULLINET, M.","LES TROIS AVEUGLES, COMÉDIE",n.av.,1783,Comédie,moeurs françaises,Un acte,prose,GOULLINET_TROISAVEUGLES
tc0413,"GRESSET, Jean-Baptiste-Louis","ÉDOUARD III, TRAGÉDIE ",1673,1740,Tragédie,histoire anglaise,Cinq actes,vers,GRESSET_EDOUARDIII
tc0414,"GUDIN de la BRENELLERIE, Paul-Philippe","LOTHAIRE, ROI DE LORRAINE, TRAGÉDIE",n.av.,1759,Tragédie,histoire française,Cinq actes,vers,GUDIN_LOTHAIRE
tc0415,"GUERIN de BOUSCAL, Daniel","DON QUICHOTTE DE LA MANCHE, COMÉDIE.",n.av.,1639,Tragi-comédie,moeurs espagnoles,Cinq actes,vers,GUERINDEBOUSCAL_DOMQUIXOTE
tc0416,"GUERIN de BOUSCAL, Daniel","DON QUICHOTTE DE LA MANCHE, COMÉDIE.",n.av.,1640,Tragi-comédie,moeurs espagnoles,Cinq actes,vers,GUERINDEBOUSCAL_DOMQUIXOTE2
tc0417,"GUERIN de BOUSCAL, Daniel","LE FILS DÉSAVOUÉ, TRAGI-COMÉDIE.",n.av.,1642,Tragi-comédie,histoire romaine,Cinq actes,vers,GUERINDEBOUSCAL_FILSDESAVOUE
tc0418,"GUEULLETTE, Thomas-Simon","L'AMANT COCHEMARD, PARADE.",n.av.,1756,Parade,moeurs françaises,Un acte,vers,GUEULLETTE_AMANTCOCHEMARD
tc0419,"GUEULLETTE, Thomas-Simon","L'AMANT POUSSIF, FARCE EN UN ACTE.",n.av.,1756,Farce,moeurs françaises,Un acte,prose,GUEULLETTE_AMANTPOUSSIF
tc0420,"GUEULLETTE, Thomas-Simon","ARLEQUIN-PLUTON, COMÉDIE INÉDITE EN TROIS ACTES",n.av.,1719,Comédie,mythe grac,Trois actes,prose,GUEULLETTE_ARLEQUINPLUTON
tc0421,"GUEULLETTE, Thomas-Simon","CARACATACA ET CARACATAQUÉ, FARCE.",n.av.,1714,Farce,moeurs françaises,Trois actes,prose,GUEULLETTE_CARACATACA
tc0422,"GUEULLETTE, Thomas-Simon","LE CHAPEAU DE FORTUNATUS, FARCE EN UN ACTE.",n.av.,1712,Farce,moeurs françaises,Un acte,prose,GUEULLETTE_CHAPEAUDEFORTUNATUS
tc0423,"GUEULLETTE, Thomas-Simon",LA CHASTE ISABELLE,n.av.,1720,Farce,moeurs françaises,Un acte,prose,GUEULLETTE_CHASTEISABELLE
tc0424,"GUEULLETTE, Thomas-Simon","LA CONFIANCE DES COCUS, FARCE EN UN ACTE.",n.av.,1720,Parade,moeurs françaises,Un acte,prose,GUEULLETTE_CONFIANCEDESCOCUS
tc0425,"GUEULLETTE, Thomas-Simon","LES FAUSSES ENVIES, PARADE.",n.av.,1740,Farce,moeurs françaises,Trois actes,prose,GUEULLETTE_FAUSSESENVIES
tc0426,"GUEULLETTE, Thomas-Simon","ISABELLE GROSSE PAR VERTU, FARCE.",n.av.,1738,Farce,moeurs françaises,Un acte,prose,GUEULLETTE_ISABELLEGROSSEPARVERTU
tc0427,"GUEULLETTE, Thomas-Simon","LÉANDRE FIACRE, PARADE",n.av.,1720,Parade,moeurs françaises,Un acte,prose,GUEULLETTE_LEANDREFIACRE
tc0428,"GUEULLETTE, Thomas-Simon","LÉANDRE HONGRE, PARADE.",n.av.,1720,Parade,moeurs françaises,Un acte,prose,GUEULLETTE_LEANDREHONGRE
tc0429,"GUEULLETTE, Thomas-Simon","LE MARCHAND DE MERDE, PARADE.",n.av.,1720,Parade,moeurs françaises,Un acte,prose,GUEULLETTE_MARCHANDDEMERDE
tc0430,"GUEULLETTE, Thomas-Simon","PREMIÈRE PARADE, FARCE.",n.av.,1714,Farce,moeurs françaises,Trois actes,prose,GUEULLETTE_PARADE1
tc0431,"GUEULLETTE, Thomas-Simon","DEUXIÈME PARADE, FARCE.",n.av.,1715,Farce,moeurs françaises,Un acte,prose,GUEULLETTE_PARADE2
tc0432,"GUIBERT, Elisabeth","LES FILLES A MARIER, COMÉDIE EN UN ACTE EN VERS.",n.av.,1768,Comédie,moeurs françaises,Un acte,vers,GUIBERT_FILLESAMARIER
tc0433,HARNY DE GUERVILLE,"LE PETIT-MAÎTRE EN PROVINCE, COMÉDIE.",n.av.,1765,Comédie,moeurs françaises,Un acte,vers,HARNY_PETITMAITREPROVINCE
tc0434,HARNY DE GUERVILLE,"LA SYBILLE, PARODIE.",n.av.,1758,Comédie,moeurs françaises,Un acte,vers,HARNY_SYBILLE
tc0435,"HAUTEROCHE, Noël LEBRETON, sieur de","LE COCHER SUPPOSÉ, COMÉDIE.",n.av.,1684,Comédie,moeurs françaises,Un acte,prose,HAUTEROCHE_COCHERSUPPOSE
tc0436,"HENAULT d'ARMOREZAN, Charles-Jean-François","MARIUS, TRAGÉDIE",1677,1702,Tragédie,histoire romaine,Cinq actes,vers,HENAULT_MARIUSACIRTE
tc0437,"HOFFMANN, François-Benoît","L'ORIGINAL, COMÉDIE",n.av.,1797,Comédie,moeurs françaises,Un acte,mixte,HOFFMAN_ORIGINAL
tc0438,"HOFFMANN, François-Benoît","PHÈDRE, TRAGÉDIE",n.av.,1786,Opéra,mythe grec,Cinq actes,vers,HOFFMAN_PHEDRE
tc0439,"HUGO, Victor","HERNANI, OU L'HONNEUR CASTILLAN",n.av.,1830,Drame,Hitoire espagnale,Cinq actes,vers,HUGO_HERNANI
tc0440,"IMBERT, Barthélémy","L'INAUGURATION DU THÉÂTRE FRANÇAIS, COMÉDIE.",1664,1782,Comédie,moeurs françaises,Un acte,vers,IMBERT_INAUGURATION
tc0441,JAQUELIN et PHILIDOR,"PRADON, SIFFLE, BATTU ET CONTENT, COMÉDIE ANECDOTE, EN UN ACTE ET EN VAUDEVILLES.",n.av.,1800,Pastorale,Pastorale,Un acte,mixte,JACQUELINPHILIDOR_PRADON
tc0442,"LA CALPRENEDE, Gautier Costes de","LA BRADAMANTE, TRAGI-COMÉDIE.",1732,1637,Tragi-comédie,histoire médiévale,Cinq actes,vers,LACALPRENEDE_BRADAMANTE
tc0443,"LA CALPRENEDE, Gautier Costes de","LE CLARIONTE OU LE SACRIFICE SANGLANT, TRAGI-COMÉDIE. ",1732,1637,Tragi-comédie,histoire médiévale,Cinq actes,vers,LACALPRENEDE_CLARIONTE
tc0444,"LA CALPRENEDE, Gautier Costes de","LE COMTE D'ESSEX, TRAGÉDIE.",1732,1654,Tragédie,histoire anglaise,Cinq actes,vers,LACALPRENEDE_COMTEDESSEX
tc0445,"LA CALPRENEDE, Gautier Costes de","ÉDOUARD, TRAGI-COMÉDIE.",n.av.,1640,Tragi-comédie,histoire anglaise,Cinq actes,vers,LACALPRENEDE_EDOUARD
tc0446,"LA CALPRENEDE, Gautier Costes de","LA MORT DES ENFANTS D'HÉRODE OU SUITE DE MARIANE , TRAGÉDIE.",n.av.,1639,Tragédie,histoire romaine,Cinq actes,vers,LACALPRENEDE_ENFANTSDHERODE
tc0447,"LA CALPRENEDE, Gautier Costes de","HERMÉNÉGILDE, TRAGÉDIE.",1732,1644,Tragédie,histoire chrétienne,Cinq actes,prose,LACALPRENEDE_HERMENEGILDE
tc0448,"LA CALPRENEDE, Gautier Costes de","JEANNE, REINE D'ANGLETERRE. TRAGÉDIE.",n.av.,1638,Tragédie,histoire anglaise,Cinq actes,vers,LACALPRENEDE_JEANNE
tc0449,"LA CALPRENEDE, Gautier Costes de","LA MORT DE MITRIDATE, TRAGÉDIE",n.av.,1637,Tragédie,histoire romaine,Cinq actes,vers,LACALPRENEDE_MORTMITRHIDATE
tc0450,"LA CALPRENEDE, Gautier Costes de","PAHLANTE, TRAGÉDIE",n.av.,1642,Tragédie,mythe grec,Cinq actes,vers,LACALPRENEDE_PHALANTE
tc0451,"LA CHAPELLE, Jean de","ZAÏDE, TRAGÉDIE ",n.av.,1681,Tragédie,fiction mauresque,Cinq actes,vers,LACHAPELLE_ZAIDE
tc0452,"LA CROIX, Jean de","LA GUERRE COMIQUE OU LA DÉFENSE DE L'ÉCOLE DES FEMMES, COMÉDIE",1651,1664,Comédie,moeurs françaises,Un acte,vers,LACROIX_GUERRECOMIQUE
tc0453,"L'AFFICHARD, Thomas","LES ACTEURS DÉPLACÉS, OU L'AMANT COMEDIEN",n.av.,1737,Comédie,moeurs françaises,"Un acte, un prologue",mixte,LAFFICHARD_ACTEURSDEPLACES
tc0454,"LAFONT, Joesph de","LE NAUFRAGE, OU LA POMPE FUNÈBRE DE CRISPIN, COMÉDIE.",n.av.,1710,Comédie,moeurs françaises,Un acte,vers,LAFONT_NAUFRAGE
tc0455,"LA FONTAINE, Jean de","ASTRÉE, TRAGÉDIE",1691,1691,Tragédie lyrique,pastorale,"Trois actes, un prologue",vers,LAFONTAINE_ASTREE
tc0456,"LA FONTAINE, Jean de","CLIMÈNE, COMÉDIE.",1682,1671,Comédie,mythe grec,Un acte,vers,LAFONTAINE_CLIMENE
tc0457,"LA FONTAINE, Jean de","DAPHNÉ, OPÉRA.",1682,1682,Opéra,mythe grec,"Cinq actes, un prologue",vers,LAFONTAINE_DAPHNE
tc0458,"LA FONTAINE, Jean de","L'EUNUQUE, COMÉDIE.",1654,1654,Comédie,moeurs françaises,Un acte,vers,LAFONTAINE_EUNUQUE
tc0459,"LA FONTAINE, Jean de",LE FLORENTIN. COMÉDIE.,1685,1685,Comédie,moeurs italiennes,Un acte,vers,LAFONTAINE_FLORENTIN
tc0460,"LA FONTAINE, Jean de","GALATÉE, OPÉRA.",1682,1682,Opéra,mythe grec,Deux actes,vers,LAFONTAINE_GALATEE
tc0461,"LA FONTAINE, Jean de","RAGOTIN OU LE ROMAN COMIQUE, COMÉDIE.",n.av.,1684,Comédie,moeurs françaises,Cinq actes,vers,LAFONTAINE_RAGOTIN
tc0462,"LA FONTAINE, Jean de","LES RIEURS DU BEAU-RICHARD, BALLET.",1659,1659,Ballet,moeurs françaises,Un acte,vers,LAFONTAINE_RIEURSDUBEAURICHARD
tc0463,"LAFONT, Joseph de ; LESAGE, Alain-René","LA QUERELLE DES THÉÂTRES, PROLOGUE.",n.av.,1710,Prologue,moeurs françaises,Un acte,vers,LAFONTLESAGE_QUERELLEDESTHEATRES
tc0464,"LA FORGE, Jean de","LA JOUEUSE DUPÉE, COMÉDIE",n.av.,1664,Comédie,moeurs françaises,Un acte,vers,LAFORGE_JOUEUSEDUPEE
tc0465,"LA FOSSE, Antoine d'Aubigny","MANLIUS CAPITOLINUS, tragédie",1698,1747,Tragédie,histoire romaine,Cinq actes,vers,LAFOSSE_MANLIUS
tc0466,"LA FOSSE, Antoine d'Aubigny","L'ÉCOLE DE LA RAISON, COMÉDIE",1698,1739,Comédie,moeurs françaises,Un acte,vers,LAFOSSEM_ECOLEDELARAISON
tc0467,"LA GRANGE CHANCEL, François-Joseph","AMASIS, TRAGÉDIE",1677,1701,Tragédie,histoire égyptienne,Cinq actes,vers,LAGRANGECHANCEL_AMASIS
tc0468,"LA HARPE, Jean-François de","LE COMTE DE WARWIK, TRAGÉDIE.",1733,1764,Tragédie,histoire anglaise,Cinq actes,vers,LAHARPE_COMTEDEWARWICK
tc0469,"LA HARPE, Jean-François de","MÉLANIE ou LA RELIGIEUSE, DRAME en trios actes et en vers",1733,1770,Drame,moeurs françaises,Trois actes,vers,LAHARPE_MELANIE
tc0470,"LA HARPE, Jean-François de","MOLIÈRE A LA NOUVELLE SALLE, OU LES AUDIENCES DE THALIE, COMÉDIE.",n.av.,1782,Comédie,mythe grec,Un acte,vers,LAHARPE_MOLIERE
tc0471,"LA HARPE, Jean-François de","LES MUSES RIVALES, COMÉDIE.",1733,1779,Comédie,mythe grec,Un acte,vers,LAHARPE_MUSESRIVALES
tc0472,"LA HARPE, Jean-François de","PHILOCTÈTE, TRAGÉDIE.",1733,1781,Tragédie,moeurs françaises,Trois actes,vers,LAHARPE_PHILOCTETE
tc0473,"LAIGNELOT, Joseph-François","AGIS, TRAGÉDIE.",n.av.,1782,Tragédie,histoire grecque,Cinq actes,vers,LAIGNELOT_AGIS
tc0474,"LA MOTTE, Antoine-Houdard de","INÈS DE CASTRO, TRAGÉDIE",n.av.,1723,Tragédie,histoire portugaise,Cinq actes,vers,LAMOTTE_INESDECASTRO
tc0475,"LA MOTTE, Antoine-Houdard de","LES MACHABÉES, TRAGÉDIE",n.av.,1722,Tragédie,bible,Cinq actes,vers,LAMOTTE_MACHABEES
tc0476,"LA MOTTE, Antoine-Houdard de","LA MATRONE D'ÉPHÈSE, COMÉDIE",n.av.,1702,Comédie,moeurs antiques,Un acte,prose,LAMOTTE_MATRONEDEPHESE
tc0477,"LA MOTTE, Antoine-Houdard de","SCANDERBERG, TRAGÉDIE",n.av.,1735,Tragédie lyrique,histoire ottomane,"Cinq actes, un prologue",vers,LAMOTTE_SCANDERBERG
tc0478,"LANTIER, Etienne François de","L'IMPATIENT, COMÉDIE.",n.av.,1779,Comédie,moeurs françaises,Un acte,vers,LANTIER_IMPATIENT
tc0479,"LEBEAU DE SCHOSME, Abbé Auguste-Théodore-Vincent  ","L'ASSEMBLÉE, COMÉDIE.",1773,1773,Comédie,moeurs françaises,Un acte,vers,LEBEAUDESCHOSNE_ASSEMBLEE
tc0480,LE BOULANGER DE CHALUSSAY,"ELOMIRE HYPOCONDRE OU LES MÉDECINS VENGÉS, COMÉDIE",n.av.,1670,Comédie,moeurs françaises,Cinq actes,vers,LEBOULANGERCHALUSSAY_ELOMIREHYPOCONDRE
tc0481,"POMPIGNAN, Jean-Jacques Lefranc, marquis de","DIDON, TRAGÉDIE .",1734,1734,Tragédie,mythe romain,Cinq actes,vers,LEFRANC_DIDON
tc0482,"LEGOUVÉ, Jean-Baptiste","ATTILIE, TRAGÉDIE.",n.av.,1776,Tragédie,histoire romaine,Cinq actes,vers,LEGOUVE_ATTILIE
tc0483,"LEGOUVÉ, Gabriel","ÉTÉOCLE, TRAGÉDIE.",n.av.,1799,Tragédie,mythe grec,Cinq actes,vers,LEGOUVE_ETEOCLE
tc0484,"LEGOUVÉ, Gabriel","LAURENCE ET ORZANO, TRAGÉDIE.",n.av.,1784,Tragédie,mythe grec,Cinq actes,vers,LEGOUVE_LAURENCEORZANO
tc0485,"LEGOUVÉ, Gabriel","POLIXÈNE, TRAGÉDIE.",n.av.,1784,Tragédie,mythe grec,Cinq actes,vers,LEGOUVE_POLIXENE
tc0486,"LEGRAND, Marc-Antoine","LA FAMILLE EXTRAVAGANTE, COMÉDIE.",n.av.,1709,Comédie,moeurs françaises,Un acte,vers,LEGRAND_FAMILLEEXTRAVAGANTE
tc0487,"LEGRAND, Marc-Antoine","LA NOUVEAUTÉ, COMÉDIE.",n.av.,1727,Comédie,moeurs françaises,Un acte,vers,LEGRAND_NOUVEAUTE
tc0488,"LEGRAND, Marc-Antoine","L'USURIER GENTILHOMME, COMÉDIE.",n.av.,1713,Comédie,moeurs françaises,Un acte,prose,LEGRAND_USURIERGENTILHOMME
tc0489,"LE MIERRE, Antoine-Marin","ARTAXERCE, TRAGÉDIE.",1768,1768,Tragédie,histoire perse,Cinq actes,vers,LEMIERRE_ARTAXERCE
tc0490,"LE MIERRE, Antoine-Marin",GUILLAUME TELL.,1766,1767,Tragédie,histoire suisse,Cinq actes,vers,LEMIERRE_GUILLAUMETELL
tc0491,"LE MIERRE, Antoine-Marin","LA VEUVE DU MALABAR, ou L'empire des coutumes.",1770,1770,Tragédie,moeurs françaises,Cinq actes,vers,LEMIERRE_VEUVEMALABAR
tc0492,"LESAGE, Alain-René","ARLEQUIN MAHOMET, COMÉDIE",n.av.,1714,Comédie,moeurs françaises,Un acte,vers,LESAGE_ARLEQUINMAHOMET
tc0493,"LESAGE, Alain-René","CRISPIN UN RIVAL DE SON MAITRE, COMÉDIE",n.av.,1707,Comédie,moeurs françaises,Un acte,prose,LESAGE_CRISPINRIVALDESONMAITRE
tc0494,LESAGE et DORNEVAL,"L'ÎLE DU GOUGOU, COMÉDIE",n.av.,1720,Comédie,moeurs françaises,Deux actes,prose,LESAGEDORNEVAL_ILEGOUGOU
tc0495,"LE TELLIER, Jean-François",DON JUAN OU LE FESTIN DE PIERRE.,n.av.,1713,Opéra comique,moeurs françaises,"Trois actes, un prologue",vers,LETELLIER_DOMJUAN
tc0496,"LE VAYER DE BOUTIGNY, Roland","LE GRAND SÉLIM OU LE COURONNEMENT TRAGIQUE, TRAGÉDIE",n.av.,1645,Tragédie,histoire ottomane,Cinq actes,vers,LEVAYER_GRANDSELIM
tc0497,"LINANT, Michel","ALZAÏDE, TRAGÉDIE",n.av.,1746,Tragédie,histoire française,Cinq actes,vers,LINANT_ALZAIDE
tc0498,"LONGEPIERRE, Hilaire de","MÉDÉE, TRAGÉDIE",n.av.,1694,Tragédie,mythe grec,Cinq actes,vers,LONGEPIERRE_MEDEE
tc0499,"MAGNON, Jean","ARTAXERXE, TRAGÉDIE",1645,1645,Tragédie,histoire perse,Cinq actes,vers,MAGNON_ARTAXERXE
tc0500,"MAGNON, Jean","JOSAPHAT, TRAGI-COMÉDIE",n.av.,1647,Tragi-comédie,bible,Cinq actes,vers,MAGNON_JOSAPHAT
tc0501,"MAGNON, Jean","LE MARIAGE D'OROONDATE ET DE STATIRA, OU LA CONCLUSION DE CASSANDRE, TRAGI-COMÉDIE",n.av.,1648,Tragi-comédie,histoire orientale,Cinq actes,vers,MAGNON_MARIAGEOROONDATE
tc0502,"MAGNON, Jean","SÉJANUS, TRAGÉDIE",1645,1647,Tragédie,histoire romaine,Cinq actes,vers,MAGNON_SEJANUS
tc0503,"MAGNON, Jean","TAMERLAN, TRAGÉDIE",1645,1648,Tragédie,histoire perse,Cinq actes,vers,MAGNON_TAMERLAN
tc0504,"MAIRET, Jean","L'ILLUSTRE CORSAIRE, TRAGI-COMÉDIE",n.av.,1640,Tragi-comédie,meours françaises,Cinq actes,vers,MAIRET_ILLUSTRECORSAIRE
tc0505,"MAIRET, Jean","SOPHONISBE, TRAGÉDIE",n.av.,1635,Tragédie,histoire romaine,Cinq actes,vers,MAIRET_SOPHONISBE
tc0506,"MARÉCHAL, Pierre-Sylvain","LE JUGEMENT DERNIER DES ROIS, PROPHÉTIE.",n.av.,1793,Comédie,histoire européenne,Un acte,prose,MARECHAL_JUGEMENTDERNIERDESROIS
tc0507,MARIVAUX,"LES ACTEURS DE BONNE FOI, COMÉDIE",n.av.,1757,Comédie,moeurs françaises,Un acte,prose,MARIVAUX _ACTEURSDEBONNEFOI
tc0508,MARIVAUX,"ANNIBAL, TRAGÉDIE.",n.av.,1720,Tragédie,histoire romaine,Cinq actes,vers,MARIVAUX_ANNIBAL
tc0509,MARIVAUX,"ARLEQUIN POLI PAR L'AMOUR, COMÉDIE",n.av.,1723,Comédie,moeurs françaises,Un acte,prose,MARIVAUX_ARLEQUINPOLIPARLAMOUR
tc0510,MARIVAUX,"LA COLONIE, COMÉDIE",n.av.,1750,Comédie,moeurs françaises,Un acte,prose,MARIVAUX_COLONIE
tc0511,MARIVAUX,"LA COMMÈRE, COMÉDIE",n.av.,1741,Comédie,moeurs françaises,Un acte,prose,MARIVAUX_COMMERE
tc0512,MARIVAUX,"LE DÉNOUEMENT IMPRÉVU, COMÉDIE.",n.av.,1727,Comédie,moeurs françaises,Un acte,prose,MARIVAUX_DENOUEMENTIMPREVU
tc0513,MARIVAUX,"LA DISPUTE, COMÉDIE",n.av.,1747,Comédie,moeurs françaises,Un acte,prose,MARIVAUX_DISPUTE
tc0514,MARIVAUX,"LA DOUBLE INCONSTANCE, COMÉDIE.",n.av.,1724,Comédie,moeurs françaises,Trois actes,prose,MARIVAUX_DOUBLEINCONSTANCE
tc0515,MARIVAUX,"L'ÉCOLE DES MÈRES, COMÉDIE.",n.av.,1732,Comédie,moeurs françaises,Un acte,mixte,MARIVAUX_ECOLEDESMERES
tc0516,MARIVAUX,"L'ÉPREUVE, COMÉDIE.",n.av.,1740,Comédie,moeurs françaises,Un acte,mixte,MARIVAUX_EPREUVE
tc0517,MARIVAUX,"LES FAUSSES CONFIDENCES, COMÉDIE",n.av.,1737,Comédie,moeurs françaises,Trois actes,prose,MARIVAUX_FAUSSESCONFIDENCES
tc0518,MARIVAUX,LA FAUSSE SUIVANTE OU LE FOURBE PUNI,n.av.,1729,Comédie,moeurs françaises,Trois actes,prose,MARIVAUX_FAUSSESUIVANTE
tc0519,MARIVAUX,"FÉLICIE, COMÉDIE",n.av.,1750,Comédie,moeurs françaises,Un acte,prose,MARIVAUX_FELICIE
tc0520,MARIVAUX,LA FEMME FIDÈLE,n.av.,1750,Comédie,moeurs françaises,Un acte,prose,MARIVAUX_FEMMEFIDELE
tc0521,MARIVAUX,L'HÉRITIER DE VILLAGE,n.av.,1729,Comédie,moeurs françaises,Un acte,prose,MARIVAUX_HERITIERDEVILLAGE
tc0522,MARIVAUX,"L'HEUREUX STRATAGÈME, COMÉDIE",n.av.,1733,Comédie,moeurs françaises,Trois actes,prose,MARIVAUX_HEUREUXSTRATAGEME
tc0523,MARIVAUX,"L'ÎLE DE LA RAISON ou les PETITS HOMMES, COMÉDIE",n.av.,1727,Comédie,moeurs françaises,"Trois actes, un prologue",prose,MARIVAUX_ILEDELARAISON
tc0524,MARIVAUX,"L'ILE DES ESCLAVES, COMÉDIE",n.av.,1725,Comédie,moeurs françaises,Un acte,prose,MARIVAUX_ILEDESESCLAVES
